VIRAT_S_050000_03_000585_000639,43,50,gray car driving next to black car
VIRAT_S_050000_03_000585_000639,43,51,a grey jeep passing by a parked black scooter
VIRAT_S_050000_03_000585_000639,43,51,a silver car leaving behind a white bike parked
VIRAT_S_050000_03_000585_000639,43,51,a silver suv leaving behind a white bike
VIRAT_S_050000_03_000585_000639,44,43,a white bike left behind by a silver van
VIRAT_S_050000_03_000585_000639,44,43,a white motorcycle being passed by by a silver car
VIRAT_S_050000_03_000585_000639,46,35,a man in grey shirt walking beside a woman in white pull
VIRAT_S_050000_03_000585_000639,46,35,a woman in white pants passing by a woman in white t-shirt
VIRAT_S_050000_03_000585_000639,46,35,a woman with backpack walking near a woman in white shirt
VIRAT_S_050000_03_000585_000639,46,47,a man in gray shirt being passed by man riding a bicycle
VIRAT_S_050000_03_000585_000639,46,47,a woman with white trousers being passed by a cyclist with an helmet
VIRAT_S_050000_03_000585_000639,46,52,a pedestrian with white jeans leaving behind of a black bike parked
VIRAT_S_050000_03_000585_000639,46,52,a woman in a white pants crossing the road behind a parked black car
VIRAT_S_050000_03_000585_000639,46,52,a woman in gray shirt walking past black motorcyle
VIRAT_S_050000_03_000585_000639,46,53,a pedestrian with white pants leaving behind a black bike
VIRAT_S_050000_03_000585_000639,46,53,a pedestrian with white pants leaving behind a black bike parked
VIRAT_S_050000_03_000585_000639,46,53,a woman in grey dress with backpack crossing to the left of parked black bike
VIRAT_S_050000_03_000585_000639,47,46,a guy with a white helmet passing by a pedestrian with white pants
VIRAT_S_050000_03_000585_000639,47,46,a man cycling beside a man with white pants
VIRAT_S_050000_03_000585_000639,47,46,cyclist driving next to girl in white pants
VIRAT_S_050000_03_000585_000639,50,43,a black pick up truck left behind by a light silver car
VIRAT_S_050000_03_000585_000639,50,43,a black pickup passed by a silver suv on a two-way street
VIRAT_S_050000_03_000585_000639,50,43,a silver car leaving behind a black pick up truck parked
VIRAT_S_050000_03_000585_000639,50,51,a black colour car parked near the black colour motor bike
VIRAT_S_050000_03_000585_000639,50,51,a black jeep in front of a black jeep parked together with a motorcycle behind a white car
VIRAT_S_050000_03_000585_000639,50,51,a black pick-up standing before a motorcycle
VIRAT_S_050000_03_000585_000639,51,43,a black motorcycle passed by silver car
VIRAT_S_050000_03_000585_000639,51,43,a motorbike parked horizontally behind a white car on the far right lane passed through by a white truck from its left
VIRAT_S_050000_03_000585_000639,51,43,a white bike parked on a roadside passed by a silver suv on a two-way street
VIRAT_S_050000_03_000585_000639,51,50,a motorcycle is parked behind a black color car
VIRAT_S_050000_03_000585_000639,51,50,a road motorcycle parked near a black car
VIRAT_S_050000_03_000585_000639,52,28,a black bike being left behind by a pedestrian with a brown t-shirt and blue jeans
VIRAT_S_050000_03_000585_000639,52,28,a black colour motor bike parked where a man in brown colour shirt and blue colour jeans with bag is walking
VIRAT_S_050000_03_000585_000639,52,46,a black colour motor bike parked near a person with grey t-shirt white pants and black bag passing
VIRAT_S_050000_03_000585_000639,52,46,a black motorcycle being passed by a man in gray shirt
VIRAT_S_050000_03_000585_000639,52,46,a black motorcycle parked being left behind by a man with white pants
VIRAT_S_050000_03_000585_000639,52,53,a black motorbike parked near a black and red motorbike
VIRAT_S_050000_03_000585_000639,52,53,a white colour motor bike parked before the black colour motor bike
VIRAT_S_050000_03_000585_000639,53,46,a black bike parked on a roadside passed by a man with a backpack on a two-way street
VIRAT_S_050000_03_000585_000639,53,46,a black motorbike parked beside a man in a grey shirt walking
VIRAT_S_050000_03_000585_000639,53,46,a black motorbike parked horizontally being passed by a young person wearing white trouser
VIRAT_S_050000_03_000585_000639,53,52,a black bike parked on a roadside close to a black bike parked on a roadside
VIRAT_S_050000_03_000585_000639,53,52,a black colour motor bike parked near another black colour motor bike
VIRAT_S_050000_03_000585_000639,53,52,a black colour motor bike parked near the white colour motor bike
VIRAT_S_050300_08_001705_001771,5,118,a black colour small truck running before the grey colour car
VIRAT_S_050300_08_001705_001771,5,118,a black pickup followed by a black hatchback on a two-way street
VIRAT_S_050300_08_001705_001771,6,25,a clear grey car driving in the opposite direction of a khaki car
VIRAT_S_050300_08_001705_001771,6,25,a white car crossing to the left moving away from a light grey truck
VIRAT_S_050300_08_001705_001771,6,25,gray car passing by a gray jeep
VIRAT_S_050300_08_001705_001771,16,17,a white car moving in front of a grey car
VIRAT_S_050300_08_001705_001771,16,17,the white car driving in front the black car
VIRAT_S_050300_08_001705_001771,17,16,a gray car driving behind a white suv
VIRAT_S_050300_08_001705_001771,17,16,a grey car following a white jeep
VIRAT_S_050300_08_001705_001771,17,16,a grey car following a white suv
VIRAT_S_050300_08_001705_001771,17,19,a dark gray car driving in front of a light gray car
VIRAT_S_050300_08_001705_001771,17,19,a dark grey car going ahead of a silver car
VIRAT_S_050300_08_001705_001771,17,19,a grey colour car running near the silver colour car
VIRAT_S_050300_08_001705_001771,19,17,a silver car driving past gray car
VIRAT_S_050300_08_001705_001771,19,17,a silver car driving past gray car stuck in traffic
VIRAT_S_050300_08_001705_001771,19,17,gray car driving behind a black car
VIRAT_S_050300_08_001705_001771,19,33,a car of silver color overtaking a red car
VIRAT_S_050300_08_001705_001771,19,33,a silver car following a red car on a two-way street
VIRAT_S_050300_08_001705_001771,19,33,a silver car going behind of a dark red car
VIRAT_S_050300_08_001705_001771,25,6,a grey jeep passing by grey car at a crossroad
VIRAT_S_050300_08_001705_001771,25,6,a grey suv passing by a silver sedan on a two-way street
VIRAT_S_050300_08_001705_001771,33,19,a maroon colour car running before silver colour car
VIRAT_S_050300_08_001705_001771,33,19,a red car driving passed by by a silver car
VIRAT_S_050300_08_001705_001771,33,19,a red car going ahead of a silver car
VIRAT_S_050300_08_001705_001771,34,36,a grey car travelling before a red car
VIRAT_S_050300_08_001705_001771,34,36,a silver car followed by a red car on a two-way street
VIRAT_S_050300_08_001705_001771,34,36,a silver colour car running before the red colour car
VIRAT_S_050300_08_001705_001771,34,93,a silver color car running ahead of a black color car on the road
VIRAT_S_050300_08_001705_001771,34,93,a white car being chased by a third car colored black on its right
VIRAT_S_050300_08_001705_001771,34,93,a white car driving in front of a gray car
VIRAT_S_050300_08_001705_001771,36,34,a red car going behind of a white car
VIRAT_S_050300_08_001705_001771,36,34,a red sedan following a silver sedan on a two-way street
VIRAT_S_050300_08_001705_001771,36,34,a red sedan following a silver sedan on a two-way street
VIRAT_S_050300_08_001705_001771,36,94,a red car going ahead of a dark green car
VIRAT_S_050300_08_001705_001771,36,94,a red sedan followed by a black sedan on a two-way street
VIRAT_S_050300_08_001705_001771,36,94,a red sedan followed by a black sedan on a two-way street
VIRAT_S_050300_08_001705_001771,43,44,a black car in front of a white car overtaking another black car ahead of a red jeep
VIRAT_S_050300_08_001705_001771,43,44,a grey colour car running near the black colour car
VIRAT_S_050300_08_001705_001771,43,45,a black car going ahead of a red pickup truck
VIRAT_S_050300_08_001705_001771,43,45,a black car moving ahead of a red truck on the adjacent lane
VIRAT_S_050300_08_001705_001771,43,45,a black sedan followed by a red suv on a two-way street
VIRAT_S_050300_08_001705_001771,43,47,a black car driving in front of white car
VIRAT_S_050300_08_001705_001771,43,47,a black car going further and faster than the grey car
VIRAT_S_050300_08_001705_001771,43,47,a black colour car running before the white colour car
VIRAT_S_050300_08_001705_001771,43,92,a black car going behind of a black pickup truck
VIRAT_S_050300_08_001705_001771,43,92,a black sedan following a black pickup on a two-way street
VIRAT_S_050300_08_001705_001771,44,43,a black car passed by a black jeep
VIRAT_S_050300_08_001705_001771,44,43,a black coupe car being outrun by a black sedan car on a two-way street
VIRAT_S_050300_08_001705_001771,44,43,a maroon color car overtaken by black color car
VIRAT_S_050300_08_001705_001771,44,91,a black car moving behind a black car
VIRAT_S_050300_08_001705_001771,44,91,a black color four wheeler passing after grey color four wheeler car
VIRAT_S_050300_08_001705_001771,44,91,a black colour car running behind a maroon colour car
VIRAT_S_050300_08_001705_001771,45,43,a red jeep following a black car in adjacent lane
VIRAT_S_050300_08_001705_001771,45,43,a red pickup driving near to a black suv
VIRAT_S_050300_08_001705_001771,45,43,red color car with luggage compartment running on a lane near to block sedan car
VIRAT_S_050300_08_001705_001771,45,48,a red color car running in front of a black car
VIRAT_S_050300_08_001705_001771,45,48,a red pickup followed by a black hatchback on a two-way street
VIRAT_S_050300_08_001705_001771,45,48,a red truck leading a black car
VIRAT_S_050300_08_001705_001771,47,43,a silver colour car running behind the black colour car
VIRAT_S_050300_08_001705_001771,47,43,a white car following a black suv
VIRAT_S_050300_08_001705_001771,47,43,a white sedan following a black sedan on a two-way street
VIRAT_S_050300_08_001705_001771,47,48,a white car leaving behind a black car
VIRAT_S_050300_08_001705_001771,47,48,a white color car running beside a silver color car
VIRAT_S_050300_08_001705_001771,48,45,a black car driving behind a red car
VIRAT_S_050300_08_001705_001771,48,45,a grey colour car running behind a red colour car
VIRAT_S_050300_08_001705_001771,48,45,a small car following a larger one
VIRAT_S_050300_08_001705_001771,48,47,a black car driving beside a white car
VIRAT_S_050300_08_001705_001771,48,47,black car driving next to a gray car
VIRAT_S_050300_08_001705_001771,48,52,a black car moving near a bus waiting
VIRAT_S_050300_08_001705_001771,48,52,a grey mini car passing by a green bus on a two-way street
VIRAT_S_050300_08_001705_001771,48,52,black car driving next to blue bus
VIRAT_S_050300_08_001705_001771,52,48,a green bus being left behind by a black mini car
VIRAT_S_050300_08_001705_001771,52,48,a green bus stopping nearby a passing greenish jeep
VIRAT_S_050300_08_001705_001771,65,66,a black bike following a reddish jeep
VIRAT_S_050300_08_001705_001771,65,66,a black bike going behind of a dark red car
VIRAT_S_050300_08_001705_001771,65,66,a man on a bike following a red suv on a two-way street
VIRAT_S_050300_08_001705_001771,66,65,a maroon car driving in front of a motorbike
VIRAT_S_050300_08_001705_001771,66,65,a maroon car followed closely by a black motorbike
VIRAT_S_050300_08_001705_001771,66,65,a red car driving in front of a man riding a motorcycle
VIRAT_S_050300_08_001705_001771,83,84,a white car driving in front of gray car
VIRAT_S_050300_08_001705_001771,83,84,a white car followed by a grey car on a two-way street
VIRAT_S_050300_08_001705_001771,83,84,a white sedan followed by a grey mini car on a two-way street
VIRAT_S_050300_08_001705_001771,84,83,a grey car going behind of white car
VIRAT_S_050300_08_001705_001771,84,83,a grey colour suv running behind the white colour car
VIRAT_S_050300_08_001705_001771,84,83,a grey hatchback following a white sedan on a two-way street
VIRAT_S_050300_08_001705_001771,84,93,a silver colour car running opposite to the grey colour car
VIRAT_S_050300_08_001705_001771,84,93,a silver mini car passed by a black sedan on a two-way street
VIRAT_S_050300_08_001705_001771,85,104,a grey car running behind a black car
VIRAT_S_050300_08_001705_001771,85,104,a silver car going behind of a black car
VIRAT_S_050300_08_001705_001771,85,104,a silver colour car running behind the black colour car
VIRAT_S_050300_08_001705_001771,86,88,a blue sedan followed by a white sedan on a two-way street
VIRAT_S_050300_08_001705_001771,86,88,a blue sedan followed by a white sedan on a two-way street
VIRAT_S_050300_08_001705_001771,86,88,a dark grey car going ahead of a silver car
VIRAT_S_050300_08_001705_001771,88,86,a white car chasing behind a grey car
VIRAT_S_050300_08_001705_001771,88,86,a white car driving behind a grey car
VIRAT_S_050300_08_001705_001771,88,86,a white car driving behind dark blue car
VIRAT_S_050300_08_001705_001771,91,44,a maroon car running in front of black car
VIRAT_S_050300_08_001705_001771,91,44,a red sedan followed by a black sedan on a two-way street
VIRAT_S_050300_08_001705_001771,92,43,a black pick up truck being followed by a black car
VIRAT_S_050300_08_001705_001771,92,43,a black van driving in front black car
VIRAT_S_050300_08_001705_001771,92,43,black pickup truck driving in front of black car
VIRAT_S_050300_08_001705_001771,93,34,a black car driving behind a white car
VIRAT_S_050300_08_001705_001771,93,34,a black car going far behind of a white car
VIRAT_S_050300_08_001705_001771,93,34,a maroon car running behind grey car
VIRAT_S_050300_08_001705_001771,93,84,a black car passing by a grey car
VIRAT_S_050300_08_001705_001771,93,84,a grey car going on the opposite way and passing by a black car
VIRAT_S_050300_08_001705_001771,93,84,black car passing by a gray car
VIRAT_S_050300_08_001705_001771,94,36,a black color car running behind the red color car
VIRAT_S_050300_08_001705_001771,94,36,a black pickup travelling behind a red pickup
VIRAT_S_050300_08_001705_001771,94,103,a black car crossing a white car
VIRAT_S_050300_08_001705_001771,94,103,a grey car passing by a white car on a two-way street
VIRAT_S_050300_08_001705_001771,99,101,a black car going further than the black car
VIRAT_S_050300_08_001705_001771,99,101,black car driving in front of the slower black car
VIRAT_S_050300_08_001705_001771,100,101,a white colour car running near the grey colour car
VIRAT_S_050300_08_001705_001771,100,101,a white truck moving together with a black car
VIRAT_S_050300_08_001705_001771,101,99,a grey colour car running behind the black colour car
VIRAT_S_050300_08_001705_001771,101,99,a grey sports car following a grey crossover on a two-way street
VIRAT_S_050300_08_001705_001771,101,100,a black car driving beside white car
VIRAT_S_050300_08_001705_001771,101,102,black car driving in same direction as pickup truck behind
VIRAT_S_050300_08_001705_001771,101,102,dark car driving in front of a dark pickup truck
VIRAT_S_050300_08_001705_001771,101,104,a black car driving in front of a maroon car
VIRAT_S_050300_08_001705_001771,101,104,a black color in front of another black color car
VIRAT_S_050300_08_001705_001771,101,104,a black colour car running before the grey colour car
VIRAT_S_050300_08_001705_001771,102,101,a black truck following a black car on the adjacent lane
VIRAT_S_050300_08_001705_001771,102,101,a dark grey car running behind black car
VIRAT_S_050300_08_001705_001771,102,101,a grey pickup following a black sedan on a two-way street
VIRAT_S_050300_08_001705_001771,103,94,a white colour small truck running opposite to the grey colour car
VIRAT_S_050300_08_001705_001771,103,94,a white pickup passing by a silver sedan on a two-way street
VIRAT_S_050300_08_001705_001771,103,94,a white pickup truck going on the opposite direction of a black car
VIRAT_S_050300_08_001705_001771,104,85,a black car being followed by a white car
VIRAT_S_050300_08_001705_001771,104,85,a black car driving in front of a white car
VIRAT_S_050300_08_001705_001771,104,85,a black car going ahead of a white car
VIRAT_S_050300_08_001705_001771,104,101,a black car following a black car
VIRAT_S_050300_08_001705_001771,104,101,a black sedan following a black sedan on a two-way street
VIRAT_S_050300_08_001705_001771,118,5,a brown car moving behind black truck
VIRAT_S_050300_08_001705_001771,118,5,a shorter black car driving behind longer black car
VIRAT_S_050300_08_001705_001771,118,5,black car driving behind black pickup truck
VIRAT_S_010203_05_000515_000593,10,16,a fat women in white t-shirt walking behind man in black shirt
VIRAT_S_010203_05_000515_000593,10,16,a women in white shirt walking behind a boy roller skating in black shirt
VIRAT_S_010203_05_000515_000593,10,16,a women in white shirt walking behind a man in black shirt
VIRAT_S_010203_05_000515_000593,16,10,a guy skateboarding ahead of a woman in white t-shirt
VIRAT_S_010203_05_000515_000593,16,10,a guy with a black t-shirt on a skateboard going far ahead of a woman with a white t-shirt
VIRAT_S_010203_05_000515_000593,16,10,a man on a skateboard followed by a woman in a white t-shirt
VIRAT_S_010202_06_000784_000873,9,10,a guy with a white t-shirt on a skateboard leaving behind a man with a white shirt
VIRAT_S_010202_06_000784_000873,9,10,a young boy skating in front of a guy in a white t-shirt
VIRAT_S_010202_06_000784_000873,10,9,a man in a white shirt walking near a boy skateboarding
VIRAT_S_010202_06_000784_000873,10,9,a man wearing white shirt walking towards his car after a young person riding on roller skates passed through his car from its left
VIRAT_S_010202_06_000784_000873,11,24,a girl in pink shirt walking in front of an old man in grey shirt
VIRAT_S_010202_06_000784_000873,11,24,a women in orange shirt walking pass by a man walking with blue roller bag
VIRAT_S_010202_06_000784_000873,17,18,a guy in a golf car going on the same direction than a green package
VIRAT_S_010202_06_000784_000873,17,18,a man in white shirt driving behind a green luggage
VIRAT_S_010202_06_000784_000873,17,18,a white car going behind a woman with tally bag
VIRAT_S_010202_06_000784_000873,18,17,a green box wheeled followed by a man in a golf cart
VIRAT_S_010202_06_000784_000873,18,17,a man moving behind a white trolley
VIRAT_S_010202_06_000784_000873,18,17,a wheeled box followed by a man in a golf cart
VIRAT_S_010202_06_000784_000873,20,24,a blue container transported by a man in a celadon shirt
VIRAT_S_010202_06_000784_000873,20,24,a blue garbage can carried by an old man with white hair
VIRAT_S_010202_06_000784_000873,20,24,a suitcase being drawn by a man's right hand
VIRAT_S_010202_06_000784_000873,24,11,a man drawing his suitcase by right hand walking opposite a woman carrying her bag
VIRAT_S_010202_06_000784_000873,24,11,a old man with a white shirt walking on the opposite direction of a girl with a red t-shirt
VIRAT_S_010202_06_000784_000873,24,20,a middle age man walking with his luggage
VIRAT_S_010202_06_000784_000873,24,25,a bald man in white shirt with luggage walking faster before a lady in black dress
VIRAT_S_010202_06_000784_000873,24,25,a man in a white shirt walking in front of a woman in a white skirt
VIRAT_S_010202_06_000784_000873,24,25,an old man wearing bermudas walking ahead of a woman wearing a black and white skirt
VIRAT_S_010202_06_000784_000873,24,26,a man in a celadon shirt followed by a woman in a black shirt
VIRAT_S_010202_06_000784_000873,24,26,a man in white shirt walking in front of a woman in black sleeveless shirt
VIRAT_S_010202_06_000784_000873,24,26,a man with a blue suitcase walking ahead of a woman in black pants
VIRAT_S_010202_06_000784_000873,25,24,a woman in a white skirt following a man in a celadon shirt
VIRAT_S_010202_06_000784_000873,25,26,a lady in black t-shirt and white scart with luggage walking with a lady in black dress with luggage
VIRAT_S_010202_06_000784_000873,25,26,a woman with a black t-shirt walking by a woman with black pants
VIRAT_S_010202_06_000784_000873,25,26,a woman with a grey shoulder bag walking beside a woman in black pants with a travel bag
VIRAT_S_010202_06_000784_000873,26,24,a woman in black pants walking behind a man carrying a blue suitcase
VIRAT_S_010202_06_000784_000873,26,24,a woman with black pants walking behind of an old man with bermudas
VIRAT_S_010202_06_000784_000873,26,24,a women in white shirt walking behind a man in white shirt
VIRAT_S_010202_06_000784_000873,26,25,a black-haired woman with pants and a luggage walking next to a woman with a skirt and a luggage
VIRAT_S_010202_06_000784_000873,26,25,a girl with black jeans walking by a girl with a black and white skirt
VIRAT_S_010202_06_000784_000873,30,31,a man in black colour clothes walking with the man in black t-shirt and brown colour shorts with carry bag
VIRAT_S_010202_06_000784_000873,30,31,a man with a white bag walking beside a man in black trousers
VIRAT_S_010202_06_000784_000873,30,31,a man with a white bag walking beside a man in black trousers
VIRAT_S_010202_06_000784_000873,31,30,a guy with a black t-shirt walking by a guy wearing bermudas
VIRAT_S_010202_06_000784_000873,31,30,a man in black shirt walking beside a man in black shirt
VIRAT_S_010202_06_000784_000873,31,30,a man in black trousers walking beside a man in grey shorts
VIRAT_S_000206_07_001501_001600,27,28,a black car running in front of grey car
VIRAT_S_000206_07_001501_001600,27,28,a black color car running in front of a grey color car
VIRAT_S_000206_07_001501_001600,27,28,black pick up truck driving in front grey car
VIRAT_S_000206_07_001501_001600,27,29,black pick up truck passing by grey car in the opposite line
VIRAT_S_000206_07_001501_001600,28,27,a beige car running behind a black car
VIRAT_S_000206_07_001501_001600,28,27,a grey car behind of a black van
VIRAT_S_000206_07_001501_001600,28,27,a grey car driving behind a black car
VIRAT_S_000206_07_001501_001600,28,29,a beige car driving the opposite way as a silver car
VIRAT_S_000206_07_001501_001600,28,29,a beige car passed by a silver car close to a parking lot
VIRAT_S_000206_07_001501_001600,28,29,a beige sedan passed by a grey sedan near a parking lot
VIRAT_S_000206_07_001501_001600,28,43,a beige car driving the opposite way as a white car
VIRAT_S_000206_07_001501_001600,28,43,a beige car passed by a silver car close to a parking lot
VIRAT_S_000206_07_001501_001600,28,43,a grayish car passing by a bluish jeep
VIRAT_S_000206_07_001501_001600,29,27,a grey car moving near a black car stopping
VIRAT_S_000206_07_001501_001600,29,27,a silver car driving opposite to a black car
VIRAT_S_000206_07_001501_001600,29,28,a grey car meeting another grey car travelling in the opposite direction behind a black pickup
VIRAT_S_000206_07_001501_001600,29,28,a white car driving passed a silver car
VIRAT_S_000206_07_001501_001600,42,44,a black car slowing down being passed by a black car
VIRAT_S_000206_07_001501_001600,42,44,a grey sedan passing by a grey hatchback near a parking lot
VIRAT_S_000206_07_001501_001600,42,44,black car passing by another black car in the opposite lane
VIRAT_S_000206_07_001501_001600,42,45,a black car driving in front of a blue suv
VIRAT_S_000206_07_001501_001600,42,45,a black car going ahead of a blue suv
VIRAT_S_000206_07_001501_001600,42,45,a maroon colour car running before the blue colour suv
VIRAT_S_000206_07_001501_001600,43,28,a grayish jeep passing by a yellowish car
VIRAT_S_000206_07_001501_001600,43,28,a silver car passing by a beige car near a parking lot
VIRAT_S_000206_07_001501_001600,43,28,a silver wagon passing by a beige sedan near a parking lot
VIRAT_S_000206_07_001501_001600,44,42,a black hatchback passing by a black sedan near a parking lot
VIRAT_S_000206_07_001501_001600,44,42,a grey sedan passing by a black sedan near a parking lot
VIRAT_S_000206_07_001501_001600,44,42,a violet car passing a black car
VIRAT_S_000206_07_001501_001600,44,45,a black car driving in the opposite direction of a blue car
VIRAT_S_000206_07_001501_001600,44,45,a grey mini car passing by a blue suv near a parking lot
VIRAT_S_000206_07_001501_001600,44,45,a grey sedan passing by a blue suv near a parking lot
VIRAT_S_000206_07_001501_001600,45,42,a grey suv driving behind a black car
VIRAT_S_000206_07_001501_001600,45,44,a blue car going by a black car
VIRAT_S_000206_07_001501_001600,45,44,a blue colour suv passing opposite near the grey colour car
VIRAT_S_000206_07_001501_001600,45,44,a grey colour suv running opposite to the black colour car
VIRAT_S_000206_07_001501_001600,46,47,a red car passed by a beige car near a parking lot
VIRAT_S_000206_07_001501_001600,46,47,a red colour car passing near the golden colour car
VIRAT_S_000206_07_001501_001600,46,47,a red suv passing by a grey car
VIRAT_S_000206_07_001501_001600,47,46,a grey car moving near a red car
VIRAT_S_000206_07_001501_001600,47,46,a grey suv meeting a red suv
VIRAT_S_000206_07_001501_001600,47,46,a sand colour suv going on the opposite direction of a red suv
VIRAT_S_010107_00_000019_000057,3,14,a black car parked next to a black suv
VIRAT_S_010107_00_000019_000057,3,14,a black car parked very close to another black car
VIRAT_S_010107_00_000019_000057,3,14,a dark-coloured car parked next to a larger black car
VIRAT_S_010107_00_000019_000057,14,3,a black suv standing beside a black car
VIRAT_S_010107_00_000019_000057,14,3,a black van parked by a black car
VIRAT_S_010107_00_000019_000057,19,28,a blue car parked a bit further from a grey car
VIRAT_S_010107_00_000019_000057,19,28,a blue car parked close to a silver car at a parking lot
VIRAT_S_010107_00_000019_000057,19,28,an electric blue car parked diagonal to a silver car
VIRAT_S_010107_00_000019_000057,19,30,a blue car parked near a gray car
