ILSVRC2015_train_00783000,1,2,a yellow colour truck parking behind the red colour car
ILSVRC2015_train_00783000,1,2,a yellow school bus following a red pickup on a one-way street
ILSVRC2015_train_00783000,2,0,a red colour van with open window running before the another red colour van
ILSVRC2015_train_00783000,2,0,a silver and red pickup truck parked in front of a red pickup truck
ILSVRC2015_train_00783000,2,0,two red trucks waiting behind a stopped school bus
ILSVRC2015_train_00783000,2,1,a red colour car running before the yellow colour school bus
ILSVRC2015_train_00783000,2,1,a red pickup followed by a yellow school bus on a one-way street
ILSVRC2015_train_00783000,2,1,a red pickup followed by a yellow school but on a one-way street
ILSVRC2015_train_00783000,2,3,a red colour small truck running behind the yellow colour school bus
ILSVRC2015_train_00783000,2,3,a red colour small truck standing behind the yellow colour school bus
ILSVRC2015_train_00783000,2,3,a red pickup passing by a yellow school bus on a one-way street
ILSVRC2015_train_00783000,3,0,a yellow bus stopped in front of a red truck
ILSVRC2015_train_00783000,3,2,a yellow bus driving in front of a red car
ILSVRC2015_train_00783000,3,2,a yellow bus driving in front of a red car
ILSVRC2015_train_00783000,3,2,a yellow school bus driving in front of red car
VIRAT_S_010206_00_000007_000035,8,9,a lady in white t-shirt walking with another lady in white and red t-shirt
VIRAT_S_010206_00_000007_000035,8,9,a woman in a white blouse walking beside a woman in a striped blouse
VIRAT_S_010206_00_000007_000035,8,9,a woman with white t-shirt walking by a woman with a t-shirt with white and red stripes
VIRAT_S_010206_00_000007_000035,8,10,a woman in white shirt walking in front of a woman in black sleeveless shirt
VIRAT_S_010206_00_000007_000035,8,10,a woman with a white t-shirt walking ahead of a girl with a black t-shirt
VIRAT_S_010206_00_000007_000035,8,10,a woman with white t-shirt walking ahead of a woman with black t-shirt
VIRAT_S_010206_00_000007_000035,8,11,a woman in white top walking away from a man entering a shop
VIRAT_S_010206_00_000007_000035,8,11,a woman with white t-shirt walking ahead of a man with a t-shirt with white and red stripes
VIRAT_S_010206_00_000007_000035,9,8,a woman in a striped t-shirt walking beside a woman in a white t-shirt
VIRAT_S_010206_00_000007_000035,9,8,a woman in a striped t-shirt walking beside a woman with a white t-shirt
VIRAT_S_010206_00_000007_000035,9,8,a woman in striped t-shirt walking together with a woman in white t-shirt
VIRAT_S_010206_00_000007_000035,9,10,a woman with a red and white striped t-shirt walking ahead of a woman with a light brown handbag
VIRAT_S_010206_00_000007_000035,9,10,a woman with a t-shirt red with white stripes walking ahead of a woman with a black t-shirt a olive green pants
VIRAT_S_010206_00_000007_000035,10,8,a woman in a black shirt following a woman in a white shirt
VIRAT_S_010206_00_000007_000035,10,8,a woman in a black shirt walking behind a woman in a white shirt walking
VIRAT_S_010206_00_000007_000035,10,8,a woman with dark pull walking behind a woman with with pull
VIRAT_S_010206_00_000007_000035,10,9,a woman with a bag following a woman with a purse
VIRAT_S_010206_00_000007_000035,10,11,a girl with a black t-shirt walking ahead of a man with a t-shirt with white and red stripes
VIRAT_S_010206_00_000007_000035,10,11,a woman walking in front of a men that goes to the bar
VIRAT_S_010206_00_000007_000035,11,8,a man in white striped shirt walking behind a woman in white shirt
VIRAT_S_010206_00_000007_000035,11,8,a man in white t-shirt walking behind a lady in white dress
VIRAT_S_010206_00_000007_000035,11,10,a man with a striped shirt walking behind a woman with a purse
VIRAT_S_010206_00_000007_000035,11,10,a woman with a beige bag moving away from a man in a striped t-shirt
VIRAT_S_050000_05_000696_000732,0,31,a white van driving along a parked van
VIRAT_S_050000_05_000696_000732,0,31,a white van going by a white parked van
VIRAT_S_050000_05_000696_000732,0,31,a white van passing beside another white van
VIRAT_S_050000_05_000696_000732,0,32,a white cargo car moving beside a white motorbike parked
VIRAT_S_050000_05_000696_000732,0,32,a white color van taking right and running on the road near to a white color bike parked at parking area
VIRAT_S_050000_05_000696_000732,0,32,a white van taking right and running near to a white bike parked in parking slot
VIRAT_S_050000_05_000696_000732,0,42,a white car running behind a women
VIRAT_S_050000_05_000696_000732,0,42,a white cargo car moving near a woman in a grey pull
VIRAT_S_050000_05_000696_000732,0,42,a white van driving near a women walking in white trouser
VIRAT_S_050000_05_000696_000732,1,10,a black bike in front of a grey car parked where a white truck pullig a crane passes by
VIRAT_S_050000_05_000696_000732,1,10,a black bike parked on a roadside passed by a white tow truck on a two-way street
VIRAT_S_050000_05_000696_000732,1,10,a parked black motor bicycle passed by a white truck
VIRAT_S_050000_05_000696_000732,1,45,a black bike parked on a roadside passed by a black sports car on a two-way street
VIRAT_S_050000_05_000696_000732,1,45,a black colour motor bike parked from where a black colour car passing
VIRAT_S_050000_05_000696_000732,1,45,a parked motorcycle being passed by a black convertible
VIRAT_S_050000_05_000696_000732,1,47,a black bike parked ahead of a black bike
VIRAT_S_050000_05_000696_000732,1,47,a black motorcycle covered by a stoplight parked in front of another black motorcycle
VIRAT_S_050000_05_000696_000732,1,47,a dark gray motorcycle parked near a black motorcycle
VIRAT_S_050000_05_000696_000732,1,48,a black motorbike parking in front of a white cargo car parking
VIRAT_S_050000_05_000696_000732,1,48,black motorcycle standing near a white van
VIRAT_S_050000_05_000696_000732,1,48,motorbike one car length in front white van
VIRAT_S_050000_05_000696_000732,3,10,a black motorcycle being passed by white truck
VIRAT_S_050000_05_000696_000732,3,10,a motorbike parked horizontally in between a white and a black car taken over by a tow trailer after traffic light
VIRAT_S_050000_05_000696_000732,3,10,a white color bike parked near to a heavy truck with jcb running on the road
VIRAT_S_050000_05_000696_000732,3,38,a bike with white color parked near to a car with red color running on the road
VIRAT_S_050000_05_000696_000732,3,38,a black colour motor bike parked on the road from where a red colour car passing
VIRAT_S_050000_05_000696_000732,3,38,white motorcycle standing next to moving red car
VIRAT_S_050000_05_000696_000732,5,15,a traffic cone standing as a grey vehicle passes
VIRAT_S_050000_05_000696_000732,5,16,a traffic signal cone kept on the road from where a black colour car passing
VIRAT_S_050000_05_000696_000732,5,16,an orange and white road cone passed by a black car
VIRAT_S_050000_05_000696_000732,5,16,an orange traffic cone passed by a black suv on a two-way street
VIRAT_S_050000_05_000696_000732,8,10,a orange traffic cone passed by a white tow truck on a two-way street
VIRAT_S_050000_05_000696_000732,8,10,an orange and white road cone passed by a white truck pulling a yellow tractor
VIRAT_S_050000_05_000696_000732,8,10,an orange traffic cone passed by a white road repair vehicle
VIRAT_S_050000_05_000696_000732,9,21,an orange and white road cone beside road blocks placed in front of another orange and white road cone
VIRAT_S_050000_05_000696_000732,9,21,an orange traffic cone standing close to an orange traffic cone
VIRAT_S_050000_05_000696_000732,9,21,and orange traffic cone near a traffic fence standing close to another orange traffic cone
VIRAT_S_050000_05_000696_000732,9,38,a traffic barrel being left behind by a red car
VIRAT_S_050000_05_000696_000732,9,38,a traffic barrel left behind by a red car
VIRAT_S_050000_05_000696_000732,9,45,an orange and white road cone passed by a black car
VIRAT_S_050000_05_000696_000732,9,45,an orange and white road cone passed by a black car
VIRAT_S_050000_05_000696_000732,10,1,a road repair truck riding by a bike parked on a roadside
VIRAT_S_050000_05_000696_000732,10,1,a white truck moving beside a black motorbike parked
VIRAT_S_050000_05_000696_000732,10,3,a white colour loader truck passing near the black colour motor bike parked
VIRAT_S_050000_05_000696_000732,10,3,a white tow truck carrying a backhoe loader passing by a black bike
VIRAT_S_050000_05_000696_000732,10,3,a white tow truck passing by black bike parked on a roadside
VIRAT_S_050000_05_000696_000732,10,8,a heavy truck trailing with jcb running on the road near to a road cone fitted on left side
VIRAT_S_050000_05_000696_000732,10,8,a white colour towing truck passing near the traffic safety cone
VIRAT_S_050000_05_000696_000732,10,8,white truck driving next to traffic cone
VIRAT_S_050000_05_000696_000732,10,15,a white tow truck passing by a grey pickup on a two-way street
VIRAT_S_050000_05_000696_000732,10,15,a white tow truck with a heavy load going the opposite direction of a silver pick up truck
VIRAT_S_050000_05_000696_000732,10,17,a white road repair vehicle passing by an orange traffic cone on a two-way street
VIRAT_S_050000_05_000696_000732,10,17,a white tow truck carrying a backhoe loader passing by a traffic barrel
VIRAT_S_050000_05_000696_000732,10,17,a white truck passing by a traffic barrel
VIRAT_S_050000_05_000696_000732,10,18,a white truck moving near a traffic cone
VIRAT_S_050000_05_000696_000732,10,18,a white truck pulling a yellow tractor passing by a road cone
VIRAT_S_050000_05_000696_000732,10,18,white tow truck driving next to traffic cone
VIRAT_S_050000_05_000696_000732,10,19,a white tow truck carrying a backhoe loader passing by a traffic barrel
VIRAT_S_050000_05_000696_000732,10,19,a white tow truck with a load leaving behind a traffic barrel
VIRAT_S_050000_05_000696_000732,10,19,a white truck leaving behind a traffic barrel
VIRAT_S_050000_05_000696_000732,10,20,a tow truck hauling a heavy-duty vehicle past a traffic cone
VIRAT_S_050000_05_000696_000732,10,20,a white long tow trailer driving through first road block after traffic light from its right
VIRAT_S_050000_05_000696_000732,10,20,a white truck moving near a traffic cone
VIRAT_S_050000_05_000696_000732,10,21,a white truck carrying a yellow tractor letting behind a traffic barrel
VIRAT_S_050000_05_000696_000732,10,21,a white truck moving near a traffic cone
VIRAT_S_050000_05_000696_000732,10,40,a white truck driving in front of a red car
VIRAT_S_050000_05_000696_000732,10,40,a white truck leading a red car
VIRAT_S_050000_05_000696_000732,10,45,a white truck carrying a yellow loader leading a black car with grey roof
VIRAT_S_050000_05_000696_000732,10,45,a white truck driving in front of a black car
VIRAT_S_050000_05_000696_000732,10,45,a white truck running in front of a black car
VIRAT_S_050000_05_000696_000732,10,47,a white truck moving near a black moto
VIRAT_S_050000_05_000696_000732,10,48,a white tow truck carrying a backhoe loader passing by a parked white van
VIRAT_S_050000_05_000696_000732,10,48,a white tow truck passing by a white minivan on a two-way street
VIRAT_S_050000_05_000696_000732,10,48,a white truck with a crane on its carriage passing by a white van parked in front of a black bike
VIRAT_S_050000_05_000696_000732,15,5,a dark gray car driving past an orange and white road cone
VIRAT_S_050000_05_000696_000732,15,5,a grey car running to the right of placed white with orange barricade
VIRAT_S_050000_05_000696_000732,15,5,a silver pickup passing by an orange traffic cone on a two-way street
VIRAT_S_050000_05_000696_000732,15,10,a grey truck moving in other direction of a white truck
VIRAT_S_050000_05_000696_000732,15,10,a white truck moving beside a grey truck
VIRAT_S_050000_05_000696_000732,15,10,gray pickup truck passing by white tow truck
VIRAT_S_050000_05_000696_000732,15,16,a gray car driving in front of black van
VIRAT_S_050000_05_000696_000732,15,16,a gray truck driving in front of a black van
VIRAT_S_050000_05_000696_000732,15,16,a grey truck moving in front of a black car
VIRAT_S_050000_05_000696_000732,15,38,a dark silver pick up truck going on the opposite direction of a red car
VIRAT_S_050000_05_000696_000732,15,38,a grey pick up truck going on the opposite direction of a red car
VIRAT_S_050000_05_000696_000732,15,38,a silver pickup passing by a red hatchback on a two-way street
VIRAT_S_050000_05_000696_000732,16,5,a black car moving near a traffic cone
VIRAT_S_050000_05_000696_000732,16,5,a black car passing by a traffic cone on a two-way street
VIRAT_S_050000_05_000696_000732,16,5,a black van passing by road cone
VIRAT_S_050000_05_000696_000732,16,15,a black car driving behind a dark gray car
VIRAT_S_050000_05_000696_000732,16,15,a black crossover following a grey pickup on a two-way street
VIRAT_S_050000_05_000696_000732,16,15,a black suv following a grey pickup on a two-way street
VIRAT_S_050000_05_000696_000732,16,38,a black colour car running opposite to the red colour car
VIRAT_S_050000_05_000696_000732,16,38,a black jeep passing by a red car on the opposite lane
VIRAT_S_050000_05_000696_000732,16,38,a black suv driving opposite side to a red car
VIRAT_S_050000_05_000696_000732,16,45,a black car driving the opposite way of a black car with a beige roof
VIRAT_S_050000_05_000696_000732,16,45,a black crossover passing by a black sports car on a two-way street
VIRAT_S_050000_05_000696_000732,16,45,a black suv going on the opposite direction of a black car
VIRAT_S_050000_05_000696_000732,17,10,a traffic cone near a white truck moving
VIRAT_S_050000_05_000696_000732,17,10,traffic cone standing next to moving white tow truck
VIRAT_S_050000_05_000696_000732,18,10,a white colour truck loading jcb passing near the traffic signal cone
VIRAT_S_050000_05_000696_000732,19,10,a traffic cone being passed by a road repair truck
VIRAT_S_050000_05_000696_000732,19,10,a traffic cone near a white truck moving
VIRAT_S_050000_05_000696_000732,19,45,a traffic cone located near a passing black car
VIRAT_S_050000_05_000696_000732,19,45,a work cone being passed by a black convertible
VIRAT_S_050000_05_000696_000732,19,45,an orange traffic cone passed by a black sports car on a two-way street
VIRAT_S_050000_05_000696_000732,20,10,a red and white colour traffic divider cone near a passing white trailer truck on which yellow tractor mounted
VIRAT_S_050000_05_000696_000732,20,10,an orange and white road cone passed by a white truck carrying a yellow tractor
VIRAT_S_050000_05_000696_000732,20,10,an orange and white road cone passed by a white truck pulling a yellow tractor
VIRAT_S_050000_05_000696_000732,21,9,a orange traffic cone kept near a orange traffic cone
VIRAT_S_050000_05_000696_000732,21,9,a road cone with orange color fitted on the road next to a road cone fitted near to a barrier gate
VIRAT_S_050000_05_000696_000732,21,9,traffic cone standing next to traffic cone
VIRAT_S_050000_05_000696_000732,21,10,a construction barrel affixed in front of a white van while a white truck passes by
VIRAT_S_050000_05_000696_000732,21,10,a orange traffic corn passed by a white truck
VIRAT_S_050000_05_000696_000732,21,10,a traffic barrel placed nearby a passing white truck
VIRAT_S_050000_05_000696_000732,21,38,a orange traffic cone passed by a red car
VIRAT_S_050000_05_000696_000732,21,38,a traffic cone near a red car moving
VIRAT_S_050000_05_000696_000732,21,38,a traffic cone standing near to the lane being used by a mobile red vehicle
VIRAT_S_050000_05_000696_000732,21,45,a road cone fitted near to a vehicle running with black color
VIRAT_S_050000_05_000696_000732,21,45,a traffic cone near a black car moving
VIRAT_S_050000_05_000696_000732,21,45,a traffic cone passed by a black car moving
VIRAT_S_050000_05_000696_000732,21,46,a orange traffic cone passed by a gray car
VIRAT_S_050000_05_000696_000732,21,46,an orange and white road cone passed by a dark gray car
VIRAT_S_050000_05_000696_000732,21,46,an orange traffic cone passed by a silver sedan on a two-way street
VIRAT_S_050000_05_000696_000732,21,47,a orange color road cone fitted opposite to a black color bike
VIRAT_S_050000_05_000696_000732,21,47,a traffic cone near a black moto parking
VIRAT_S_050000_05_000696_000732,21,47,an orange traffic cone standing close to a bike parked on a roadside
VIRAT_S_050000_05_000696_000732,25,31,a grey car behind a red car passing by a parked white van
VIRAT_S_050000_05_000696_000732,25,31,a silver car going ahead of a parked white van
VIRAT_S_050000_05_000696_000732,25,33,a grey car driving before a black car
VIRAT_S_050000_05_000696_000732,25,33,a sedan car with light brown color running on the road in front of a car with hatchback and grey color compartment
VIRAT_S_050000_05_000696_000732,25,33,a white car moving faster before a black car
VIRAT_S_050000_05_000696_000732,25,40,a golden colour car passing behind the red colour car
VIRAT_S_050000_05_000696_000732,25,40,a yellow car driving through traffic light trailing behind a red car
VIRAT_S_050000_05_000696_000732,25,40,gray car driving behind a red car
VIRAT_S_050000_05_000696_000732,31,0,a white color van parked near to a same type van running on the road
VIRAT_S_050000_05_000696_000732,31,0,white van standing next to moving white van
VIRAT_S_050000_05_000696_000732,31,25,a white van being left behind by a silver car
VIRAT_S_050000_05_000696_000732,31,25,a white van parked nearby a passing grey car
VIRAT_S_050000_05_000696_000732,31,25,a white van parked nearby a passing grey car
VIRAT_S_050000_05_000696_000732,31,33,a white color van parked at parking area near to a car running with grey color hatchback compartment
VIRAT_S_050000_05_000696_000732,31,33,a white color van parked near to a vehicle running with grey color body
VIRAT_S_050000_05_000696_000732,31,33,a white van passed by a dark gray car
VIRAT_S_050000_05_000696_000732,31,42,a white car parked to the right of woman walking with backpack
VIRAT_S_050000_05_000696_000732,31,42,a white van parked near a crossing woman in a white suit
VIRAT_S_050000_05_000696_000732,31,42,a white van passed by a woman carrying a black bag
VIRAT_S_050000_05_000696_000732,32,0,a parked white motorcycle passed by a white van
VIRAT_S_050000_05_000696_000732,32,0,a parked white motorcycle passed by a white van
VIRAT_S_050000_05_000696_000732,32,0,a white motorcycle being left behind by a white van
VIRAT_S_050000_05_000696_000732,33,25,a dark grey car going behind a silver car
VIRAT_S_050000_05_000696_000732,33,25,a grey car following a beige car on a two-way street
VIRAT_S_050000_05_000696_000732,33,31,a dark grey car leaving behind a white van
VIRAT_S_050000_05_000696_000732,33,31,a dark grey car leaving behind a white van
VIRAT_S_050000_05_000696_000732,33,31,a grey car leaving behind a white van
VIRAT_S_050000_05_000696_000732,33,34,a grey car sedan passing by a man in a grey shirt and white pants
VIRAT_S_050000_05_000696_000732,33,34,black car passing by man in a white pants
VIRAT_S_050000_05_000696_000732,33,40,a black car moving behind a red car
VIRAT_S_050000_05_000696_000732,33,40,a car with hatchback and grey color running on the road behind a luxury car with red color
VIRAT_S_050000_05_000696_000732,34,33,a man in a grey shirt passed by a grey hatchback on a two-way street
VIRAT_S_050000_05_000696_000732,34,33,a man in a grey shirt passed by a silver hatchback on a two-way street
VIRAT_S_050000_05_000696_000732,34,33,a man in gray shirt being passed by a dark gray car
VIRAT_S_050000_05_000696_000732,34,38,a man in white pants passed by a red car on a two-way street
VIRAT_S_050000_05_000696_000732,34,38,a man with white pants crossing the road once a hatchback car with red color running on the road
VIRAT_S_050000_05_000696_000732,34,38,a women in gray shirt passed by a red car
VIRAT_S_050000_05_000696_000732,34,40,a man in grey shirt being passed by by a red car
VIRAT_S_050000_05_000696_000732,34,40,a man with white pants and grey shirt crossing the road after a red color luxury car running on the road
VIRAT_S_050000_05_000696_000732,34,45,a man in a white pants standing at pedestrian crossing whilst a car with a white roof passed by
VIRAT_S_050000_05_000696_000732,34,45,a man with white pants crossing the road after a black color car with back opening running on the road
VIRAT_S_050000_05_000696_000732,34,45,a person with white jeans left behind by a black car
VIRAT_S_050000_05_000696_000732,34,46,a man in white pants walking behind a grey car
VIRAT_S_050000_05_000696_000732,34,46,a man with white pants and grey shirt crossing the road after a silver sedan car running on the road
VIRAT_S_050000_05_000696_000732,38,3,a red hatchback passing by a black bike parked on a roadside
VIRAT_S_050000_05_000696_000732,38,9,a car with red color running near to a first road cone fitted on the road from signal light
VIRAT_S_050000_05_000696_000732,38,9,a red car passing by traffic cone
VIRAT_S_050000_05_000696_000732,38,9,a red colour car passing by a traffic safety cone
VIRAT_S_050000_05_000696_000732,38,15,a red car driving the opposite way of gray car
VIRAT_S_050000_05_000696_000732,38,15,a red color car with hatchback compartment running opposite road to a silver car with back opening luggage compartment
VIRAT_S_050000_05_000696_000732,38,15,red car diving in the opposite direction of the gray truck
VIRAT_S_050000_05_000696_000732,38,16,red car passing by a black car
VIRAT_S_050000_05_000696_000732,38,16,red minivan passing by a black car
VIRAT_S_050000_05_000696_000732,38,21,a red car leaving behind an orange traffic barrel
VIRAT_S_050000_05_000696_000732,38,21,a red car passing by a traffic barrel
VIRAT_S_050000_05_000696_000732,38,21,a red car passing by an orange and white road cone
VIRAT_S_050000_05_000696_000732,38,34,a red car passing near a man in white pants
VIRAT_S_050000_05_000696_000732,38,34,a red colour car passing near the man in grey colour shirt and white colour pants
VIRAT_S_050000_05_000696_000732,38,34,a red hatchback passing by a man in a grey shirt on a two-way street
VIRAT_S_050000_05_000696_000732,38,40,a car with red color hatchback running in front of a luxury car with red color
VIRAT_S_050000_05_000696_000732,38,40,a red hatchback followed by a red sedan on a two-way street
VIRAT_S_050000_05_000696_000732,38,47,a hatchback car with red color running near to a bike with black color parked at parking area
VIRAT_S_050000_05_000696_000732,38,47,a red car going ahead of a parked black bike
VIRAT_S_050000_05_000696_000732,38,48,a red car behind a crane passing by a white van parked behind a grey car
VIRAT_S_050000_05_000696_000732,38,48,a red colour suv passing where a white colour van is parked
VIRAT_S_050000_05_000696_000732,40,10,a luxury car with red color running behind a white color heavy truck running with jcb
VIRAT_S_050000_05_000696_000732,40,10,a red car driving behind a tow car with 3 cars in between separating them
VIRAT_S_050000_05_000696_000732,40,10,a red car going 3 cars behind of a white truck carrying a yellow tractor
VIRAT_S_050000_05_000696_000732,40,25,a red car driving in front of a beige car
VIRAT_S_050000_05_000696_000732,40,25,a red car followed by a beige car on a two-way street
VIRAT_S_050000_05_000696_000732,40,25,a red car leading a grey car
VIRAT_S_050000_05_000696_000732,40,33,a red car driving in front of a gray car
VIRAT_S_050000_05_000696_000732,40,33,a red car going ahead of a dark silver car
VIRAT_S_050000_05_000696_000732,40,33,a red car leading a dark grey car
VIRAT_S_050000_05_000696_000732,40,34,a burgundy color car passing by a pedestrian with a grey shirt and white trousers
VIRAT_S_050000_05_000696_000732,40,34,a red car behind a grey car passing by a man in white pants standing at a pedestrian crossing
VIRAT_S_050000_05_000696_000732,40,34,a red car running crossing in front of man in grey dress
VIRAT_S_050000_05_000696_000732,40,38,a dark red car driving behind a bright red car
VIRAT_S_050000_05_000696_000732,40,38,a red car following a red car
VIRAT_S_050000_05_000696_000732,40,38,a red sedan following a red hatchback on a two-way street
VIRAT_S_050000_05_000696_000732,40,45,a red car driving near behind a black convertible
VIRAT_S_050000_05_000696_000732,40,46,a red car driving behind a gray car
VIRAT_S_050000_05_000696_000732,40,46,a red car driving behind a gray car on a one-lane road
VIRAT_S_050000_05_000696_000732,40,47,a red car passing by a parked black motorcycle
VIRAT_S_050000_05_000696_000732,40,47,a red sedan passing by a black bike parked on a roadside
VIRAT_S_050000_05_000696_000732,40,47,a red suv car running to the opposite of parked black bike
VIRAT_S_050000_05_000696_000732,40,48,a red car passing a stationary white van
VIRAT_S_050000_05_000696_000732,42,0,a woman in gray shirt walking past a white van
VIRAT_S_050000_05_000696_000732,42,0,a woman with a black bag passed by a white van on a two-way street
VIRAT_S_050000_05_000696_000732,42,31,a lady with free hair carrying green hand bag crossing the road near to a van with white color parked at parking area
VIRAT_S_050000_05_000696_000732,42,31,woman in beige pants walking near a white van
VIRAT_S_050000_05_000696_000732,42,31,woman walking next to white van
VIRAT_S_050000_05_000696_000732,45,1,a black color car with luggage compartment running near to a white color parking board
VIRAT_S_050000_05_000696_000732,45,1,a brown car driving near a black motorbike
VIRAT_S_050000_05_000696_000732,45,1,black car passing next to white motorcycle
VIRAT_S_050000_05_000696_000732,45,9,a black car moving near a traffic cone
VIRAT_S_050000_05_000696_000732,45,9,a black color car passing near a traffic safety cone
