VIRAT_S_010201_06_000550_000600,6,7,a man in black colour shirt and cream colour pants walking behind the man in white colour t-shirt and red colour shorts with bag
VIRAT_S_010201_06_000550_000600,6,7,a man with a black shirt and white pants walking far behind of a man with a white t-shirt and a black backpack
VIRAT_S_010201_06_000550_000600,7,6,a man in red shorts walking ahead of a man in a black shirt
VIRAT_S_010201_06_000550_000600,7,6,a man with black bag wearing red colour half pants walking in front of the man wearing brown pants
VIRAT_S_010201_06_000550_000600,7,6,boy in red shorts walking in front of man in beige pants
VIRAT_S_010201_06_000550_000600,7,9,a boy in red jersey shorts walking past a cyclist
VIRAT_S_010201_06_000550_000600,7,9,a man in white colour t-shirt and red colour shorts with black bag walking near the man in black colour clothes cycling
VIRAT_S_010201_06_000550_000600,9,7,a man in black color dress riding bicycle in front of a man in white dress
VIRAT_S_010201_06_000550_000600,9,7,a man in black shirt riding a bicycle passing by man in white shirt
VIRAT_S_010201_06_000550_000600,9,7,a man on a bike passing by a man with a backpack
VIRAT_S_010201_06_000550_000600,9,13,a cyclist with a black t-shirt riding a bike
VIRAT_S_010201_06_000550_000600,9,13,a guy with a black t-shirt riding a bike
VIRAT_S_010201_06_000550_000600,9,13,a person in black colour clothes sitting on the bicycle
VIRAT_S_010201_06_000550_000600,13,9,a bicycle being driven on the street by a man mounted on it
VIRAT_S_010201_06_000550_000600,13,9,a bicycle moving driven by a man in a black shirt
VIRAT_S_010204_05_000856_000890,0,1,a man in brown colour t-shirt and white colour shorts walking with the man in black colour clothes
VIRAT_S_010204_05_000856_000890,0,1,a man in white shorts walking beside a man in black trousers
VIRAT_S_010204_05_000856_000890,0,1,a man in white shorts walking together with a man in black pants
VIRAT_S_010204_05_000856_000890,0,2,a man in a black shirt passing by a man in a blue shirt
VIRAT_S_010204_05_000856_000890,0,2,a man in a grey shirt walking in other direction of a man in a blue shirt
VIRAT_S_010204_05_000856_000890,0,2,a man in white shorts walking opposite to a man in blue shirt
VIRAT_S_010204_05_000856_000890,0,3,a guy with white bermudas walking on the opposite direction of a girl with a brown backpack
VIRAT_S_010204_05_000856_000890,0,3,a man in a black t-shirt passing by a woman with a backpack
VIRAT_S_010204_05_000856_000890,0,3,a man in white shorts walking past a woman carrying a brownish bag
VIRAT_S_010204_05_000856_000890,0,4,a guy with white bermudas walking on the opposite direction of a girl with a blue t-shirt
VIRAT_S_010204_05_000856_000890,0,7,a man in black t-shirt walking before a skateboarder
VIRAT_S_010204_05_000856_000890,0,7,a man in white shorts walking in the opposite direction of a man in skateboard
VIRAT_S_010204_05_000856_000890,0,7,a man in white shorts walking near man in black clothes skating
VIRAT_S_010204_05_000856_000890,1,0,a man in a black shirt walking beside a man in white shorts
VIRAT_S_010204_05_000856_000890,1,0,a man in black shirt walking beside a man in gray shirt
VIRAT_S_010204_05_000856_000890,1,0,a man in black shirt walking beside man in gray shirt
VIRAT_S_010204_05_000856_000890,1,2,a man in black dress crossing to the opposite left of man walking in blue shirt
VIRAT_S_010204_05_000856_000890,1,2,a man in black t-shirt walking past a man in blue shirt
VIRAT_S_010204_05_000856_000890,1,2,a man with black t-shirt walking on the opposite direction of a man with blue shirt and a black cap
VIRAT_S_010204_05_000856_000890,1,3,a guy with a black shirt walking on the opposite direction of a girl with a dark grey backpack
VIRAT_S_010204_05_000856_000890,1,3,a guy with black t-shirt walking on the opposite direction of a girl with a brown backpack
VIRAT_S_010204_05_000856_000890,1,3,a man in black walking besides a woman
VIRAT_S_010204_05_000856_000890,1,4,a man in black pants and black t-shirt passing by a girl in blue t-shirt
VIRAT_S_010204_05_000856_000890,1,4,a man in black shirt walking past a woman in dark blue shirt
VIRAT_S_010204_05_000856_000890,1,4,a man in black t-shirt walking past a woman in blue t-shirt
VIRAT_S_010204_05_000856_000890,1,7,a guy with a black t-shirt walking on the opposite direction of a guy on a skateboard
VIRAT_S_010204_05_000856_000890,1,7,a man in black clothes meeting a skater in black clothes
VIRAT_S_010204_05_000856_000890,1,7,a man in black out fit walking before a skateboarder in black t-shirt
VIRAT_S_010204_05_000856_000890,2,0,a man in a blue shirt passing by a man in a black shirt
VIRAT_S_010204_05_000856_000890,2,0,a man in blue shirt beside two girls walking past a man in white shorts
VIRAT_S_010204_05_000856_000890,2,1,a man in a blue shirt passing a man in a dark-coloured shirt
VIRAT_S_010204_05_000856_000890,2,3,a man in a blue shirt walking beside a woman with a backpack
VIRAT_S_010204_05_000856_000890,2,3,a man with blue shirt walking with a lady with bag
VIRAT_S_010204_05_000856_000890,2,3,man in a blue shirt walking with girl in gray shirt
VIRAT_S_010204_05_000856_000890,2,4,a man in blue shirt walking beside woman in dark blue shirt
VIRAT_S_010204_05_000856_000890,2,4,a man in bluish shirt walking beside a girl in blue top
VIRAT_S_010204_05_000856_000890,2,4,a man with blue shirt walking beside a woman with black pull
VIRAT_S_010204_05_000856_000890,2,15,a guy with a blue t-shirt walking on the opposite direction of a man with a black t-shirt
VIRAT_S_010204_05_000856_000890,2,15,a man in a blue shirt passing by a man with a backpack
VIRAT_S_010204_05_000856_000890,3,0,a girl with a brown bag passing by a man in whitish shorts
VIRAT_S_010204_05_000856_000890,3,0,a woman with a grey backpack walking on the opposite direction of a man with a white bermuda
VIRAT_S_010204_05_000856_000890,3,0,a women with brown backpack walking opposite to a man in white short
VIRAT_S_010204_05_000856_000890,3,1,a girl with a gray backpack walking on the opposite direction of a man with black t-shirt
VIRAT_S_010204_05_000856_000890,3,1,a woman in backpack crossing to the left of man in black dress
VIRAT_S_010204_05_000856_000890,3,1,a woman with a backpack passing by a man in a black t-shirt
VIRAT_S_010204_05_000856_000890,3,2,a girl with a brownish bag walking next to a man in blue shirt
VIRAT_S_010204_05_000856_000890,3,2,a woman carrying a brown bag walking together with a man in blue shirt
VIRAT_S_010204_05_000856_000890,3,2,a woman with a brown backpack walking together with a man in blue shirt
VIRAT_S_010204_05_000856_000890,3,4,a girl with a brown bag walking together with a girl in blue top
VIRAT_S_010204_05_000856_000890,3,4,a woman in a grey shirt walking beside a woman in a blue shirt
VIRAT_S_010204_05_000856_000890,3,4,a woman with brown colour bag on her back walking with a woman with blue colour bag on her back
VIRAT_S_010204_05_000856_000890,3,15,a female pedestrian in black clothing walking past a male pedestrian in a grey jacket and black shirt
VIRAT_S_010204_05_000856_000890,3,15,a lady in black colour clothes with bag walking near the man in brown colour shorts with bag and cap
VIRAT_S_010204_05_000856_000890,4,0,a women in gray shirt walking opposite to a man in brown shirt
VIRAT_S_010204_05_000856_000890,4,0,a women in green shirt walking opposite to a man in white short
VIRAT_S_010204_05_000856_000890,4,1,a girl in blue t-shirt passing by a man in black pants
VIRAT_S_010204_05_000856_000890,4,1,a woman in a blue shirt walking in other direction of a man in a black shirt
VIRAT_S_010204_05_000856_000890,4,2,a lady in blue colour top and brown colour legging walking with the man in blue colour shirt and black colour pants
VIRAT_S_010204_05_000856_000890,4,2,woman wearing a blue shirt and backpack walking in front of building in parallel to man wearing blue shirt black pants and strapback hat
VIRAT_S_010204_05_000856_000890,4,3,a girl in blue t-shirt walking together with a girl with brown backpack
VIRAT_S_010204_05_000856_000890,4,3,a girl with a blue t-shirt walking besides a girl with a light brown backpack
VIRAT_S_010204_05_000856_000890,4,3,a girl with a blue t-shirt walking by a girl with a grey backpack
VIRAT_S_010204_05_000856_000890,4,15,a girl with a black t-shirt walking on the opposite direction of a guy with a black hat
VIRAT_S_010204_05_000856_000890,4,15,a girl with two other passed a boy
VIRAT_S_010204_05_000856_000890,7,0,a guy skateboarding past a man in white shorts
VIRAT_S_010204_05_000856_000890,7,0,a man on a skateboard passed by a man in white shorts
VIRAT_S_010204_05_000856_000890,7,0,a person on unicycle cycling near the man in brown colour t-shirt and white colour shorts with cap
VIRAT_S_010204_05_000856_000890,7,1,a guy on a skateboard going on the opposite direction of a man with a black t-shirt
VIRAT_S_010204_05_000856_000890,7,1,a guy riding a bicycle going on the opposite direction of a man with a black shirt
VIRAT_S_010204_05_000856_000890,7,1,a guy riding a bicycle going on the opposite direction of a man with a black shirt
VIRAT_S_010204_05_000856_000890,15,2,a man in black shorts passing a man in black trousers
VIRAT_S_010204_05_000856_000890,15,2,a man in black t-shirt and brown colour shorts with bag walking opposite to the person with blue colour shirt and black colour pants
VIRAT_S_010204_05_000856_000890,15,2,a man with a backpack walking by a man in a blue shirt
VIRAT_S_010204_05_000856_000890,15,3,a man in striped polo walking past a woman in dark green shirt
VIRAT_S_010204_05_000856_000890,15,3,a man walking opposite the woman in the middle of the group
VIRAT_S_010204_05_000856_000890,15,4,a boy in grey shorts walking away from a girl in blue t-shirt
VIRAT_S_010204_04_000646_000754,21,22,a guy with a white t-shirt walking on the opposite direction of a guy driving a bike
VIRAT_S_010204_04_000646_000754,21,22,a man in white colour t-shirt with bag walking in front of the man cycling
VIRAT_S_010204_04_000646_000754,22,21,a guy on a bicycle going on the opposite direction of a guy with a white t-shirt
VIRAT_S_010204_04_000646_000754,22,21,a man in black shirt cycling beside a man in white shirt
VIRAT_S_010204_04_000646_000754,22,21,a man on a bike passing by a man with a black backpack
ILSVRC2015_train_00302001,0,1,a yellow and red colour bus running behind the white colour concrete mixer truck
ILSVRC2015_train_00302001,1,0,a white concrete mixer approached by a yellow and red bus
ILSVRC2015_train_00302001,1,0,a white concrete mixer approached by a yellow and red bus
ILSVRC2015_train_00302001,1,0,a white lorry stopping in front of a moving yellow bus
ILSVRC2015_train_00302001,1,2,a white truck driving near a black car
ILSVRC2015_train_00302001,2,1,a black colour car running near the white colour concrete mixer truck
ILSVRC2015_train_00302001,2,1,a black sedan moving towards a white concrete mixer
ILSVRC2015_train_00897008,0,1,a black suv parked near a white car
ILSVRC2015_train_00897008,0,1,a brownish jeep parked behind a white jeep
ILSVRC2015_train_00897008,0,1,a white car parking in front of maroon silver car
ILSVRC2015_train_00897008,1,0,a white car parked in front of maroon car
ILSVRC2015_train_00897008,1,0,a white car parked on roadside close to a brown car
ILSVRC2015_train_00897008,1,0,a white colour car parked before the maroon colour car
ILSVRC2015_train_00897008,3,5,a bicycle moving past a parked grey car
ILSVRC2015_train_00897008,3,5,a blue bicycle moving past a parked silver car
ILSVRC2015_train_00897008,4,5,a silver sedan parked close to a silver audi sedan on a roadside
ILSVRC2015_train_00897008,4,5,a white color car parked behind the silver color car
ILSVRC2015_train_00897008,5,3,a grey car parked beside a passing bicycle
ILSVRC2015_train_00897008,5,3,a silver colour car parking from where a cyclist with white t-shirt and black shorts with bag cycling
ILSVRC2015_train_00897008,5,3,gray car standing near a moving cyclist
ILSVRC2015_train_00897008,5,4,a silver audi sedan parked close to a silver sedan on a roadside
ILSVRC2015_train_00897008,5,4,a silver car parked on a roadside close to a white car
ILSVRC2015_train_00897008,5,4,a silver colour car parking before the white colour car
VIRAT_S_010004_03_000239_000277,0,1,a man in a white shirt passing by a woman in a yellow t-shirt
VIRAT_S_010004_03_000239_000277,0,1,a man in grey shorts passing by a woman in black shorts
VIRAT_S_010004_03_000239_000277,1,0,a female pedestrian in black shorts meeting a man in a light-coloured shirt going in the opposite direction
VIRAT_S_010004_03_000239_000277,1,0,a woman in a yellow shirt passing by a man in a grey shirt
VIRAT_S_010004_03_000239_000277,1,0,a woman in black skirt walking near a man in shorts
VIRAT_S_010107_02_000282_000312,0,36,a white cargo car parked beside a white little bus
VIRAT_S_010107_02_000282_000312,0,36,a white van parked by a white van with black mirrors
VIRAT_S_010107_02_000282_000312,0,36,a white van parked next to another white van
VIRAT_S_010107_02_000282_000312,1,4,a white car parked in front of a white van with a white load
VIRAT_S_010107_02_000282_000312,1,4,a white colour van parked in front of white colour truck
VIRAT_S_010107_02_000282_000312,1,4,a windowless white minivan parked close to a white cargo truck at a parking lot
VIRAT_S_010107_02_000282_000312,1,36,a white van facing one way to a white van facing the opposite way at a parking lot
VIRAT_S_010107_02_000282_000312,1,36,a white van parked by a white van
VIRAT_S_010107_02_000282_000312,1,36,a white van parked near another white van on a public parking
VIRAT_S_010107_02_000282_000312,4,1,a white covered van parked in front of a white car
VIRAT_S_010107_02_000282_000312,4,1,a white truck parked beside a white car
VIRAT_S_010107_02_000282_000312,5,21,a black car parked near a gray car
VIRAT_S_010107_02_000282_000312,5,21,a black car parked near a gray car
VIRAT_S_010107_02_000282_000312,5,21,dark gray car standing near a light gray car
VIRAT_S_010107_02_000282_000312,8,34,a blue car parked by a black car
VIRAT_S_010107_02_000282_000312,8,34,blue car standing near a black car
VIRAT_S_010107_02_000282_000312,8,36,a blue hatchback parked close to a windowed white van at a parking lot
VIRAT_S_010107_02_000282_000312,8,36,a blue wagon parked near a white passenger van at a parking lot
VIRAT_S_010107_02_000282_000312,11,14,a black colour truck parking near the black colour car
VIRAT_S_010107_02_000282_000312,11,14,a black pickup parked next to a black car
VIRAT_S_010107_02_000282_000312,14,11,a black suv parked diagonal to a black pick up truck
VIRAT_S_010107_02_000282_000312,14,11,a dark blue car parked in front black car
VIRAT_S_010107_02_000282_000312,14,11,a grey car standing behind a black car in parking area
VIRAT_S_010107_02_000282_000312,18,19,a grey car parked in front of a black car
VIRAT_S_010107_02_000282_000312,18,19,a grey car parked in front of a black car
VIRAT_S_010107_02_000282_000312,18,19,a grey car parked in front of black car
VIRAT_S_010107_02_000282_000312,19,18,a black car facing a grey car
VIRAT_S_010107_02_000282_000312,19,18,a black car parked in front of a grey car parked
VIRAT_S_010107_02_000282_000312,21,5,a grey car parked across a black car on a public parking
VIRAT_S_010107_02_000282_000312,21,5,a grey car parked next to a black car
VIRAT_S_010107_02_000282_000312,21,22,a beige car parked in front of a black car
VIRAT_S_010107_02_000282_000312,21,22,a silver sedan parked close to a black sedan at a parking lot
VIRAT_S_010107_02_000282_000312,22,21,a black car parked in front of beige car
VIRAT_S_010107_02_000282_000312,22,21,a black sedan car parked in front of a parked silver sedan car
VIRAT_S_010107_02_000282_000312,34,8,a black car parked by a electric blue car
VIRAT_S_010107_02_000282_000312,34,8,a black car parked to the left of a parked blue car
VIRAT_S_010107_02_000282_000312,36,0,a white colour mini bus parked near the white colour van
VIRAT_S_010107_02_000282_000312,36,0,a white van parked next to a white van
VIRAT_S_010107_02_000282_000312,36,1,a white car parked beside white van
VIRAT_S_010107_02_000282_000312,36,1,a white colour tempo traveller parked near the white colour suv
VIRAT_S_010107_02_000282_000312,36,1,a white minibus facing out beside a white van in a car park
VIRAT_S_010107_02_000282_000312,36,8,a white car parked near a blue car
VIRAT_S_010107_02_000282_000312,36,8,a white van parked by a blue car
VIRAT_S_010002_02_000174_000204,1,4,a woman carrying a backpack walking beside a woman in white top
VIRAT_S_010002_02_000174_000204,1,4,a woman with a backpack walking at the right of a woman in white shirt
VIRAT_S_010002_02_000174_000204,4,1,a woman in long sleeved white shirt walking beside a woman in white shirt
VIRAT_S_010002_02_000174_000204,4,1,woman with white bag walking next to a woman with backpack
VIRAT_S_010208_03_000201_000232,0,6,a girl with a pink t-shirt walking beside of a woman with black t-shirt
VIRAT_S_010208_03_000201_000232,0,6,a woman in a red skirt walking beside a woman with a white bag
VIRAT_S_010208_03_000201_000232,0,6,a woman in a rose pull walking with a woman in a black pull
VIRAT_S_010208_03_000201_000232,3,4,a man in black shirt pushing two blue garbage bins
VIRAT_S_010208_03_000201_000232,3,4,a man in brown shorts pushing dustbins
VIRAT_S_010208_03_000201_000232,3,4,a man wearing shorts pushing luggage carried vehicle
VIRAT_S_010208_03_000201_000232,4,3,a couple of trash can being pushed by a man with light brown pants
VIRAT_S_010208_03_000201_000232,4,3,a couple trash cans wheeled by a man in a black t-shirt
VIRAT_S_010208_03_000201_000232,4,3,two trash cans transported by a man in a black shirt
VIRAT_S_010208_03_000201_000232,4,6,a green colour and blue color dust bins taken on hand cart passing near a woman with black top and green pants
VIRAT_S_010208_03_000201_000232,4,6,blue garbage bins pushing behind a women in black shirt
VIRAT_S_010208_03_000201_000232,4,6,blue trash cans passing by woman in black sleeveless shirt
VIRAT_S_010208_03_000201_000232,5,6,a girl in yellow jacket passing by a girl in blue jeans
VIRAT_S_010208_03_000201_000232,5,6,a woman with a yellow blouse getting away with another woman with a black t-shirt
VIRAT_S_010208_03_000201_000232,5,6,a woman with a yellow shirt approaching a woman carrying a bag
VIRAT_S_010208_03_000201_000232,5,8,a girl in yellow top walking together with a boy in white t-shirt
VIRAT_S_010208_03_000201_000232,5,8,a girl with a yellow t-shirt walking by a guy with a white t-shirt
VIRAT_S_010208_03_000201_000232,5,8,a woman in yellow shirt holding hand with the man in white t-shirt to the right
VIRAT_S_010208_03_000201_000232,5,12,a girl with a yellow sweater walking on the opposite direction of a girl with a pink t-shirt
VIRAT_S_010208_03_000201_000232,5,12,a lady with her boyfriend walking opposite to a lady wearing half skirt and sunglasses
VIRAT_S_010208_03_000201_000232,5,12,a woman in a yellow shirt walking in other direction of a woman in a rose shirt
VIRAT_S_010208_03_000201_000232,6,0,a woman carrying a bag walking along with a woman with brown skirt
VIRAT_S_010208_03_000201_000232,6,4,a woman in black top moving away from the dustbins being pushed by a man
VIRAT_S_010208_03_000201_000232,6,4,a woman with a black t-shirt walking away from two trash can being moved
VIRAT_S_010208_03_000201_000232,6,5,a fat women in black dress walking beside a slim lady in yellow dress
VIRAT_S_010208_03_000201_000232,6,5,a woman in a black shirt passed by a woman in a yellow shirt
VIRAT_S_010208_03_000201_000232,6,5,girl in black shirt walking near a girl in yellow shirt
VIRAT_S_010208_03_000201_000232,6,8,a woman in black shirt walking near a man in white shirt
VIRAT_S_010208_03_000201_000232,6,8,a woman in black top passing by a man in white t-shirt
VIRAT_S_010208_03_000201_000232,6,12,a fat lady carrying a bag walking and talking with a lady wearing sunglasses
VIRAT_S_010208_03_000201_000232,6,12,a lady in black colour top and blue colour jeans walking with the lady in pink colour top and black colour skirt
VIRAT_S_010208_03_000201_000232,6,12,a woman in a black shirt walking beside a woman in a rose shirt
VIRAT_S_010208_03_000201_000232,8,5,a man in white colour t-shirt and black colour shorts walking with the lady in yellow colour top and brown colour pants
VIRAT_S_010208_03_000201_000232,8,5,a man in white walking with a woman in yellow
VIRAT_S_010208_03_000201_000232,8,5,a man with a white shirt walking with a women in yellow shirt
VIRAT_S_010208_03_000201_000232,8,6,a man in a white shirt passing by a woman with a bag
VIRAT_S_010208_03_000201_000232,8,6,a man in white t-shirt crossing the woman in black sleeveless dress
VIRAT_S_010208_03_000201_000232,8,6,a man in white t-shirt passing by a woman in blue jeans
VIRAT_S_010208_03_000201_000232,8,12,man in white shirt passing by a girl in pink shirt
VIRAT_S_010208_03_000201_000232,12,5,a girl in skirt walking past a girl in yellow jacket
VIRAT_S_010208_03_000201_000232,12,5,a girl with a red skirt walking on the opposite direction of a girl with a yellow t-shirt
VIRAT_S_010208_03_000201_000232,12,6,a woman in a red skirt walking beside a woman in a black shirt
VIRAT_S_010208_03_000201_000232,12,8,a girl in skirt passing by a boy in white t-shirt
VIRAT_S_010208_03_000201_000232,12,8,a woman in pink colour top and brown colour skirt walking past the man in white colour t-shirt and black colour shorts
VIRAT_S_010208_03_000201_000232,12,8,a woman with pink top and red skirt with bag walking opposite a man with white t-shirt and black shorts
ILSVRC2015_train_00361000,0,1,a black car driving near a brown train
ILSVRC2015_train_00361000,0,1,a grey car moving near a train moving
ILSVRC2015_train_00361000,1,0,a train going on a different direction of a dark blue car
ILSVRC2015_train_00361000,1,0,a train moving away from a grey car
ILSVRC2015_train_00361000,1,2,a train moving away from a grey car
ILSVRC2015_train_00361000,1,2,a train passing away before the silver colour car
ILSVRC2015_train_00361000,1,2,a white cargo train passed by a silver sedan
ILSVRC2015_train_00361000,2,1,a silver colour car passing behind the train
ILSVRC2015_train_00361000,2,1,a white car crossing the railway track behind a moving train
VIRAT_S_010111_02_000198_000310,145,146,a black car parked next to white jeep
VIRAT_S_010111_02_000198_000310,145,146,a black colour car parked near the white colour suv
VIRAT_S_010111_02_000198_000310,145,146,a black colour car parked near white colour suv
VIRAT_S_010111_02_000198_000310,146,145,a white car parked to the left of a black car
VIRAT_S_010111_02_000198_000310,146,145,a white jeep parked right next to a black car
VIRAT_S_010111_02_000198_000310,146,145,a white van parked side by side with a black sedan at a parking lot
VIRAT_S_010111_02_000198_000310,146,160,a white colour suv parked opposite to the black colour suv
VIRAT_S_010111_02_000198_000310,146,160,a white jeep parked in front of a black jeep
VIRAT_S_010111_02_000198_000310,160,146,a black car parked against a white car
VIRAT_S_010111_02_000198_000310,160,146,a black car parked near a white van
VIRAT_S_010111_02_000198_000310,160,146,a black suv parked in front of a white van
VIRAT_S_010111_02_000198_000310,170,171,a dark silver car parked by a silver car
VIRAT_S_010111_02_000198_000310,170,171,a dark silver car parked close to a silver car at a parking lot
VIRAT_S_010111_02_000198_000310,170,171,a grey colour car parked near silver grey coloured car
VIRAT_S_010111_02_000198_000310,171,170,a silver sedan parked close to a grey coupe at a parking lot
VIRAT_S_010111_02_000198_000310,171,170,grey car parked next to silver convertible car
VIRAT_S_010111_02_000198_000310,172,173,a blue car parked next to a blue van at a parking lot
VIRAT_S_010111_02_000198_000310,172,173,a blue car parked next to a van
VIRAT_S_010111_02_000198_000310,172,173,a car of blue color is parked in front of a silver car
VIRAT_S_010111_02_000198_000310,173,172,a blue van parked beside black car
VIRAT_S_010111_02_000198_000310,173,172,a blue van with white roof parked next to a black car
VIRAT_S_010111_02_000198_000310,173,172,colorful van standing next to a black car
VIRAT_S_010111_02_000198_000310,176,178,a dark red car parked by a black car
VIRAT_S_010111_02_000198_000310,176,178,a maroon car parked near a black car
VIRAT_S_010111_02_000198_000310,176,180,a dark red car parked in front of black car
VIRAT_S_010111_02_000198_000310,176,180,a dark red car parked in front of black car
VIRAT_S_010111_02_000198_000310,176,180,a red sedan parked opposite a black suv at a parking lot
VIRAT_S_010111_02_000198_000310,178,176,a black car parked near a dark red car on a public parking
VIRAT_S_010111_02_000198_000310,178,176,a black car parked to the second left of maroon car
VIRAT_S_010111_02_000198_000310,178,176,black car parking in same parking lot as red car
VIRAT_S_010111_02_000198_000310,178,179,a black car parked by a white and yellow van
VIRAT_S_010111_02_000198_000310,178,179,a black car parked near a white van
VIRAT_S_010111_02_000198_000310,178,179,a black color car parked near to the suv car with white color at parking area
VIRAT_S_010111_02_000198_000310,178,182,a black car parked near a gray car
VIRAT_S_010111_02_000198_000310,178,182,a black sedan parked opposite a silver sedan at a parking lot
VIRAT_S_010111_02_000198_000310,179,178,a white and yellow colour tempo traveller parking near the black colour car
VIRAT_S_010111_02_000198_000310,179,178,a white passenger van parked next to a black sedan at a parking lot
